Id,Title,Category,Diagram,Interaction,Priority,State,Changed By,Description,Justification,Last Modified
142,Spoofing of Source Data Store Cookies,Spoofing,Request Secrets,Request Opgeslagen Cookies,High,Not Started,,Cookies may be spoofed by an attacker and this may lead to incorrect data delivered to Kerstel web server. Consider using a standard authentication mechanism to identify the source data store.,,Generated
143,Cross Site Scripting,Tampering,Request Secrets,Request Opgeslagen Cookies,High,Not Started,,The web server 'Kerstel web server' could be a subject to a cross-site scripting attack because it does not sanitize untrusted input.,,Generated
144,Persistent Cross Site Scripting,Tampering,Request Secrets,Request Opgeslagen Cookies,High,Not Started,,The web server 'Kerstel web server' could be a subject to a persistent cross-site scripting attack because it does not sanitize data store 'Cookies' inputs and output.,,Generated
145,Potential Data Repudiation by Kerstel web server,Repudiation,Request Secrets,Request Opgeslagen Cookies,High,Not Started,,"Kerstel web server claims that it did not receive data from a source outside the trust boundary. Consider using logging or auditing to record the source, time, and summary of the received data.",,Generated
146,Weak Access Control for a Resource,Information Disclosure,Request Secrets,Request Opgeslagen Cookies,High,Not Started,,Improper data protection of Cookies can allow an attacker to read information not intended for disclosure. Review authorization settings.,,Generated
147,Potential Process Crash or Stop for Kerstel web server,Denial Of Service,Request Secrets,Request Opgeslagen Cookies,High,Not Started,,"Kerstel web server crashes, halts, stops or runs slowly; in all cases violating an availability metric.",,Generated
148,Data Flow Request Opgeslagen Cookies Is Potentially Interrupted,Denial Of Service,Request Secrets,Request Opgeslagen Cookies,High,Not Started,,An external agent interrupts data flowing across a trust boundary in either direction.,,Generated
149,Data Store Inaccessible,Denial Of Service,Request Secrets,Request Opgeslagen Cookies,High,Not Started,,An external agent prevents access to a data store on the other side of the trust boundary.,,Generated
150,Kerstel web server May be Subject to Elevation of Privilege Using Remote Code Execution,Elevation Of Privilege,Request Secrets,Request Opgeslagen Cookies,High,Not Started,,Cookies may be able to remotely execute code for Kerstel web server.,,Generated
151,Elevation by Changing the Execution Flow in Kerstel web server,Elevation Of Privilege,Request Secrets,Request Opgeslagen Cookies,High,Not Started,,An attacker may pass data into Kerstel web server in order to change the flow of program execution within Kerstel web server to the attacker's choosing.,,Generated
152,Spoofing the Kerstel web server Process,Spoofing,Request Secrets,Responds Cookies,High,Not Started,,Kerstel web server may be spoofed by an attacker and this may lead to unauthorized access to Cookies. Consider using a standard authentication mechanism to identify the source process.,,Generated
153,Spoofing of Destination Data Store Cookies,Spoofing,Request Secrets,Responds Cookies,High,Not Started,,Cookies may be spoofed by an attacker and this may lead to data being written to the attacker's target instead of Cookies. Consider using a standard authentication mechanism to identify the destination data store.,,Generated
154,The Cookies Data Store Could Be Corrupted,Tampering,Request Secrets,Responds Cookies,High,Not Started,,Data flowing across Responds Cookies may be tampered with by an attacker. This may lead to corruption of Cookies. Ensure the integrity of the data flow to the data store.,,Generated
155,Data Store Denies Cookies Potentially Writing Data,Repudiation,Request Secrets,Responds Cookies,High,Not Started,,"Cookies claims that it did not write data received from an entity on the other side of the trust boundary. Consider using logging or auditing to record the source, time, and summary of the received data.",,Generated
156,Potential Excessive Resource Consumption for Kerstel web server or Cookies,Denial Of Service,Request Secrets,Responds Cookies,High,Not Started,,"Does Kerstel web server or Cookies take explicit steps to control resource consumption? Resource consumption attacks can be hard to deal with, and there are times that it makes sense to let the OS do the job. Be careful that your resource requests don't deadlock, and that they do timeout.",,Generated
157,Data Flow Responds Cookies Is Potentially Interrupted,Denial Of Service,Request Secrets,Responds Cookies,High,Not Started,,An external agent interrupts data flowing across a trust boundary in either direction.,,Generated
158,Data Store Inaccessible,Denial Of Service,Request Secrets,Responds Cookies,High,Not Started,,An external agent prevents access to a data store on the other side of the trust boundary.,,Generated
174,Kerstel web server May be Subject to Elevation of Privilege Using Remote Code Execution,Elevation Of Privilege,Request Secrets,Responds Secrets,High,Not Started,,Secrets may be able to remotely execute code for Kerstel web server.,,Generated
175,Elevation by Changing the Execution Flow in Kerstel web server,Elevation Of Privilege,Request Secrets,Responds Secrets,High,Not Started,,An attacker may pass data into Kerstel web server in order to change the flow of program execution within Kerstel web server to the attacker's choosing.,,Generated
