80,Cross Site Request Forgery,Elevation Of Privilege,,Cookie Request,High,Resolved,Timme Kingma,CSRF token toegepast,"Cross-site request forgery (CSRF or XSRF) is a type of attack in which an attacker forces a user's browser to make a forged request to a vulnerable site by exploiting an existing trust relationship between the browser and the vulnerable web site.  In a simple scenario, a user is logged in to web site A using a cookie as a credential.  The other browses to web site B.  Web site B returns a page with a hidden form that posts to web site A.  Since the browser will carry the user's cookie to web site A, web site B now can take any action on web site A, for example, adding an admin to an account.  The attack can be used to exploit any requests that the browser automatically authenticates, e.g. by session cookie, integrated authentication, IP whitelisting. The attack can be carried out in many ways such as by luring the victim to a site under control of the attacker, getting the user to click a link in a phishing email, or hacking a reputable web site that the victim will visit. The issue can only be resolved on the server side by requiring that all authenticated state-changing requests include an additional piece of secret payload (canary or CSRF token) which is known only to the legitimate web site and the browser and which is protected in transit through SSL/TLS. See the Forgery Protection property on the flow stencil for a list of mitigations."
81,Spoofing of the Browser External Destination Entity,Spoofing,,Response status,High,Resolved,Timme Kingma,CSRF token toegepast,Browser may be spoofed by an attacker and this may lead to data being sent to the attacker's target instead of Browser. Consider using a standard authentication mechanism to identify the external entity.
82,External Entity Browser Potentially Denies Receiving Data,Repudiation,,Response status,High,Not relevent,Timme Kingma,De data die verzonden word is niet van dat grote belang op gelogd te worde en ook is dit een data posible breach.,"Browser claims that it did not receive data from a process on the other side of the trust boundary. Consider using logging or auditing to record the source, time, and summary of the received data."
83,Data Flow Response status Is Potentially Interrupted,Denial Of Service,,Response status,High,Resolved,Timme Kingma,er word nu TLS 1.2/1.3 afdwingen en zwakke versies blokkeren dit zogt er voor dat alleen veilige protocolen worden toegestaan.,An external agent interrupts data flowing across a trust boundary in either direction.
95,Weak Credential Storage,Information Disclosure,,Request Secret,High,Postponed,Timme Kingma,Er is geen sprake van acounts in dit project,"Credentials held at the server are often disclosed or tampered with and credentials stored on the client are often stolen. For server side, consider storing a salted hash of the credentials instead of storing the credentials themselves. If this is not possible due to business requirements, be sure to encrypt the credentials before storage, using an SDL-approved mechanism. For client side, if storing credentials is required, encrypt them and protect the data store in which they're stored"
94,Spoofing of Destination Data Store Secrets,Spoofing,,Request Secret,High,Postponed,Timme Kingma,,Secrets may be spoofed by an attacker and this may lead to data being written to the attacker's target instead of Secrets. Consider using a standard authentication mechanism to identify the destination data store.
